name,neighbourhood,room_type,bedrooms,bathrooms,accommodates,minimum_nights,price,availability_365,number_of_reviews,review_score,latitude,longitude,is_superhost
Caesar's Apartment,RIPAMONTI,Entire home/apt,1.0,1.0,2,2,56.0,0,28,99.0,45.431509999999996,9.202119999999999,0
Design flat in Milan,STADERA,Entire home/apt,1.0,1.0,4,3,50.0,363,74,91.0,45.43575,9.18183,0
Cà Bèla Lambrate - Flat 1,PARCO LAMBRO - CIMIANO,Entire home/apt,1.0,1.0,2,1,68.0,333,95,92.0,45.48652,9.24125,1
double room linate fabrique,MECENATE,Private room,1.0,1.0,2,1,53.0,356,22,84.0,45.44673,9.251330000000001,0
Ampio bi-locale  (Home Sweet Home) Bocconi-Navigli,VIGENTINA,Entire home/apt,1.0,1.0,4,2,50.0,137,145,100.0,45.45087,9.19541,1
"Elegant penthouse with terrace! WIFI, A/C",BUENOS AIRES - VENEZIA,Entire home/apt,2.0,2.0,6,1,120.0,103,72,92.0,45.47364,9.21653,0
Stanza nel cuore dei navigli,NAVIGLI,Private room,1.0,1.0,2,1,50.0,365,170,89.0,45.4517,9.17587,0
Elegante monolocale centralissimo,DUOMO,Entire home/apt,1.0,1.0,2,1,120.0,141,361,98.0,45.46618,9.17665,1
SKYLINE VIEW APARTMENT in TORTONA DESIGN DISTRICT,TORTONA,Entire home/apt,1.0,1.0,4,3,74.0,22,29,99.0,45.45597,9.165939999999999,1
Cozy Home in Milan,NIGUARDA - CA' GRANDA,Entire home/apt,1.0,1.0,4,2,55.0,0,15,95.0,45.510220000000004,9.20205,0
ALTIDO Modern Central 2-BR Apartment in Brera,BRERA,Entire home/apt,2.0,2.0,5,1,88.0,0,46,89.0,45.47198,9.18492,0
Charm & Design Apartment with Terrace in Glamour Corso Como,GARIBALDI REPUBBLICA,Entire home/apt,1.0,1.0,4,2,113.0,221,126,99.0,45.481770000000004,9.18747,1
Grazioso appartamento a 10 min da Linate/Centro,CORSICA,Entire home/apt,1.0,1.0,3,1,48.0,335,129,100.0,45.46588,9.230410000000001,1
Private room in apartment w/ terrace,ISOLA,Private room,1.0,1.0,2,1,50.0,0,16,100.0,45.48896,9.19933,1
feel at home far from your home - come a casa,UMBRIA - MOLISE,Entire home/apt,1.0,1.0,3,2,55.0,0,32,99.0,45.4552,9.21813,0
Suggestivo Appartamento nel Design District di Lambrate,PARCO LAMBRO - CIMIANO,Entire home/apt,1.0,1.0,2,1,68.0,1,71,94.0,45.48652,9.24125,1
Urban retreat in Milan,VILLAPIZZONE,Entire home/apt,1.0,1.0,3,2,39.0,0,120,88.0,45.49757,9.14358,0
ORANGE HOUSE cheap solution! easy access to centre,GIAMBELLINO,Entire home/apt,1.0,1.0,4,2,45.0,50,135,96.0,45.448159999999994,9.137369999999999,0
Welcoming and cozy 2 bedroom apartment!,CENTRALE,Entire home/apt,2.0,1.0,3,1,100.0,0,16,100.0,45.48239,9.20379,0
Zikihouse da vivere...indipendent flat!,BUENOS AIRES - VENEZIA,Entire home/apt,1.0,1.5,2,2,56.0,0,96,99.0,45.47099,9.22128,1
a quiet oasi in Central Station,LORETO,Private room,2.0,1.0,2,2,80.0,88,14,98.0,45.48791,9.212660000000001,0
"House in the heart of Milan city center, Cozy Apt",DUOMO,Entire home/apt,1.0,1.0,4,2,95.0,258,18,94.0,45.46032,9.18088,1
"Nel cuore dell'Isola, luminoso e vista grattacieli",ISOLA,Entire home/apt,2.0,1.0,4,2,95.0,90,23,96.0,45.487790000000004,9.18705,0
The most charming courtyard on Navigli,NAVIGLI,Entire home/apt,3.0,2.0,7,2,191.0,207,145,98.0,45.45218,9.17608,0
Bright and cozy flat near Sempione Bovisa S.Siro,VILLAPIZZONE,Entire home/apt,1.0,1.0,4,2,45.0,0,28,96.0,45.495740000000005,9.15237,0
Donatello - Piola and Loreto district,BUENOS AIRES - VENEZIA,Entire home/apt,1.0,2.0,4,5,49.0,275,10,96.0,45.47955,9.2213,0
Nice flat in Milano historical area!,PORTA ROMANA,Entire home/apt,1.0,1.0,4,2,77.0,143,110,93.0,45.45528,9.20469,0
100sqm Top floor Apt. in the coolest spot of Milan,BUENOS AIRES - VENEZIA,Entire home/apt,1.0,1.0,4,3,110.0,1,14,96.0,45.47772,9.21267,0
Double bedroom in Porta Venezia - Città Studi,BUENOS AIRES - VENEZIA,Private room,1.0,1.0,2,2,35.0,89,24,100.0,45.4744,9.217419999999999,0
Colourful room with terrace,PADOVA,Private room,1.0,1.0,2,2,54.0,365,24,99.0,45.50055,9.21972,0
Central modern apartment,SARPI,Private room,2.0,1.0,3,2,90.0,0,12,100.0,45.483670000000004,9.16961,0
The Bright House in Milan,BUENOS AIRES - VENEZIA,Entire home/apt,1.0,1.5,3,2,110.0,139,23,99.0,45.47848,9.21066,1
Bel monolocale in zona centrale Milano,BUENOS AIRES - VENEZIA,Entire home/apt,1.0,1.0,2,2,52.0,80,75,98.0,45.472840000000005,9.21636,1
Prestigioso Loft in Garibaldi / Moscova,BRERA,Entire home/apt,1.0,1.0,3,4,110.0,352,12,94.0,45.4737,9.18999,0
Exquisite design apartment faced on Naviglio,RONCHETTO SUL NAVIGLIO,Entire home/apt,2.0,2.0,3,2,109.0,88,26,98.0,45.445170000000005,9.14372,0
Casetta Canella-Metro 1 red line stops at 3 min,BANDE NERE,Entire home/apt,1.0,1.0,2,1,61.0,364,12,88.0,45.460029999999996,9.13307,0
Bio Heart of  Design   apt WIFI 1 GB,TORTONA,Entire home/apt,2.0,2.0,7,4,95.0,180,28,91.0,45.45347,9.15555,0
A SPECIAL PLACE IN THE OLD TOWN,DUOMO,Entire home/apt,1.0,1.0,2,2,44.0,283,33,90.0,45.458220000000004,9.180010000000001,0
Bright attic in front of the Cathedral in Milan,DUOMO,Entire home/apt,1.0,1.0,3,2,250.0,0,11,100.0,45.46447,9.194410000000001,0
Monolocale Moscova Una Volta in Brera,SARPI,Entire home/apt,1.0,1.0,2,1,58.0,180,35,94.0,45.480140000000006,9.181989999999999,0
Small but comfortable appartment north of Loreto,PADOVA,Entire home/apt,1.0,1.0,2,2,49.0,0,26,94.0,45.4978,9.23221,0
Your apartment in Milano Duomo,DUOMO,Entire home/apt,1.0,1.0,2,1,107.0,358,66,94.0,45.46179,9.19098,1
Big and bright Flat in Porta Romana area,PORTA ROMANA,Entire home/apt,1.0,1.0,2,2,73.0,180,19,94.0,45.4507,9.21258,0
Cozy three rooms Flat  Lambrate subway - Free WiFi,LORETO,Entire home/apt,2.0,1.0,4,3,75.0,0,25,95.0,45.48648,9.23468,0
Friendly room - Central Station,CENTRALE,Private room,1.0,1.0,2,2,33.0,78,121,94.0,45.4885,9.210989999999999,0
Villa with garden near to Prada Foundation,RIPAMONTI,Entire home/apt,5.0,3.0,12,1,120.0,0,111,98.0,45.43403,9.20012,1
Charming apartment in the HEART of Milan,PORTA ROMANA,Entire home/apt,2.0,1.0,5,2,125.0,19,120,97.0,45.45078,9.20637,0
Single room 10 min from Duomo,GUASTALLA,Private room,1.0,1.0,1,2,70.0,0,25,98.0,45.467040000000004,9.2055,1
Accogliente e grazioso bilocale in zona Bovisa,BOVISA,Entire home/apt,1.0,1.0,4,4,70.0,265,171,100.0,45.49993,9.1667,1
Piazza Piola: Spacious apartment for 8 people,BUENOS AIRES - VENEZIA,Entire home/apt,3.0,2.0,8,3,145.0,0,10,86.0,45.47878,9.221910000000001,0
Lovely apt in Colonne San Lorenzo. Newly renovated,TICINESE,Entire home/apt,2.0,2.0,6,2,99.0,78,24,98.0,45.45493,9.18171,1
Camera in via Gustavo Modena,BUENOS AIRES - VENEZIA,Private room,1.0,1.0,1,7,35.0,364,52,98.0,45.47146,9.215689999999999,1
Brand new studio flat,WASHINGTON,Entire home/apt,1.0,1.0,2,29,50.0,110,40,99.0,45.46476,9.163210000000001,1
"Lovely artistic  room, in  Zara/Isola.",MACIACHINI - MAGGIOLINA,Private room,1.0,1.0,1,7,45.0,295,11,100.0,45.49872,9.20171,0
Camera matrimoniale bagno privato a 1 min da metro,DERGANO,Private room,1.0,1.0,2,2,38.0,0,68,99.0,45.49946,9.1835,1
Casa B.,GIAMBELLINO,Entire home/apt,1.0,1.0,2,1,60.0,50,25,98.0,45.45205,9.14433,0
Rooftop room with view and terrace downtown Milan,TICINESE,Private room,1.0,1.0,2,1,42.0,112,318,93.0,45.45493,9.17707,0
Flavia&Daniela,STADERA,Entire home/apt,2.0,1.0,4,2,66.0,178,16,98.0,45.42385,9.174619999999999,1
Double room 25 min from Duomo,LODI - CORVETTO,Private room,1.0,1.0,2,4,29.0,0,26,92.0,45.44056,9.21438,0
Luminoso appartamento per 5/6 persone- freeparking,VIALE MONZA,Entire home/apt,3.0,2.5,6,3,120.0,0,59,99.0,45.51235,9.232660000000001,1
2-rooms - 7th floor w/terrace close to city center,CORSICA,Entire home/apt,1.0,1.0,4,1,51.0,19,142,83.0,45.46477,9.23038,0
Elegant and cozy flat next to the centre of Milan,WASHINGTON,Entire home/apt,1.0,1.0,2,2,60.0,36,46,98.0,45.4567,9.15685,1
INDIPENDENT DESIGN HOUSE - Relax,GUASTALLA,Entire home/apt,1.0,1.0,2,3,159.0,362,13,98.0,45.45344,9.20277,0
"Renewed, Park View Apartment in Milan",NIGUARDA - CA' GRANDA,Entire home/apt,1.0,1.0,4,2,60.0,171,10,96.0,45.51937,9.19308,0
Spacious and cousy apartment in Loreto,LORETO,Entire home/apt,1.0,1.0,4,3,45.0,0,34,92.0,45.48621,9.21992,0
Modern and elegant flat with terrace for 6 persons,PADOVA,Entire home/apt,2.0,2.0,6,3,100.0,0,151,97.0,45.503029999999995,9.24398,1
Fresh apartment close to Brera and park,SARPI,Entire home/apt,1.0,1.0,4,2,71.0,30,57,99.0,45.47853,9.17853,1
Nice flat 50mq in Amendola Fiera next to the tube,DE ANGELI - MONTE ROSA,Entire home/apt,1.0,1.0,5,1,55.0,363,10,94.0,45.47553,9.14883,0
Lovely Room in milan 1,BOVISA,Private room,1.0,1.0,2,1,25.0,171,249,80.0,45.50238,9.16292,0
"900 M Da Piazza Duomo da Appartamento, a Centro Storico",DUOMO,Entire home/apt,1.0,1.0,5,1,99.0,257,127,99.0,45.45865,9.1879,1
Bright and new for 5,PADOVA,Entire home/apt,2.0,1.0,5,3,110.0,284,83,98.0,45.50297,9.24393,1
Tidy and bright apartment with terrace for 4,PADOVA,Entire home/apt,1.0,1.0,4,3,80.0,0,98,98.0,45.503029999999995,9.24362,1
Elegant and luxurious for 5,PADOVA,Entire home/apt,2.0,1.0,5,3,100.0,284,127,97.0,45.50289,9.24182,1
Sweet room in milan,BOVISA,Private room,1.0,1.0,2,1,25.0,172,248,80.0,45.50046,9.162139999999999,0
Cozy flat 50 meters from Lambrate M2 station!,CITTA' STUDI,Entire home/apt,1.0,1.0,4,2,59.0,108,122,93.0,45.48482,9.23345,0
Centre-Fiera in 15 min: Piccolo Nido Guest House W,QT 8,Entire home/apt,2.0,2.0,5,1,79.0,169,43,95.0,45.48604,9.14213,1
Bright Central and parking included 2 nights,TICINESE,Entire home/apt,1.0,1.0,8,1,27.0,353,304,92.0,45.4532,9.18297,0
Naviglio: stanza privata con bagno e colazione,NAVIGLI,Private room,1.0,1.0,2,1,42.0,0,44,97.0,45.44641,9.16428,0
"Bedroom in the heart of Milan, Navigli District",MAGENTA - S. VITTORE,Private room,1.0,1.0,2,2,50.0,180,67,94.0,45.45613,9.17247,1
Accogliente appartamento c.so XXII Marzo,XXII MARZO,Entire home/apt,2.0,1.0,6,1,100.0,0,14,95.0,45.461240000000004,9.21957,0
Hemeras BoutiqueHomes:flat 300m from the Cathedral,DUOMO,Entire home/apt,1.0,1.0,4,1,40.0,179,61,82.0,45.46257,9.1879,0
Stanza privata in appartamento,SARPI,Private room,1.0,2.0,1,1,65.0,363,28,99.0,45.486979999999996,9.160210000000001,1
House in Porta venezia,BUENOS AIRES - VENEZIA,Entire home/apt,1.0,1.0,2,1,67.0,179,23,94.0,45.47423,9.219560000000001,0
Large Designer's Lab on the Navigli,NAVIGLI,Private room,2.0,1.0,8,2,159.0,139,41,94.0,45.44927,9.17337,0
NOLo Apartments IT - TURRO M1 - near DUOMO,PADOVA,Entire home/apt,1.0,1.0,4,6,36.0,85,12,88.0,45.49817,9.22145,0
Shabby Suite,WASHINGTON,Entire home/apt,1.0,1.0,2,3,78.0,179,38,98.0,45.46647,9.152280000000001,1
Cozy apartment in the city center,NAVIGLI,Entire home/apt,1.0,1.0,4,1,89.0,101,68,91.0,45.45224,9.176639999999999,0
Double room in a lovely apartment with great view,NIGUARDA - CA' GRANDA,Private room,2.0,2.0,3,1,40.0,0,29,98.0,45.50727,9.193589999999999,1
GREAT city center location. LOVELY APARTMENT,GUASTALLA,Entire home/apt,1.0,1.0,3,2,90.0,110,15,93.0,45.46986,9.20555,1
"In a quiet and elegant setting, 600m from Duomo",DUOMO,Entire home/apt,1.0,1.0,4,2,61.0,365,16,99.0,45.4596,9.18675,0
Nice and pretty mansard in Milan,VILLAPIZZONE,Entire home/apt,1.0,1.0,3,2,44.0,109,23,100.0,45.498290000000004,9.14141,1
★Movie Star★ Apt Next to the Central Station,CENTRALE,Entire home/apt,2.0,1.0,4,2,70.0,89,282,97.0,45.488690000000005,9.20272,0
Un posto a Milano - accommodation West,PORTA ROMANA,Private room,1.0,1.0,2,1,70.0,334,34,86.0,45.45117,9.21137,0
Un posto a Milano - accommodation East,PORTA ROMANA,Private room,1.0,1.0,4,1,110.0,349,24,92.0,45.45117,9.21137,0
Appartamento Amendola,TRE TORRI,Entire home/apt,1.0,1.0,5,1,75.0,174,176,96.0,45.473690000000005,9.1515,0
La Pastrenghina - cozy studio Isola - Garibaldi,ISOLA,Entire home/apt,2.0,1.0,3,2,75.0,0,14,91.0,45.48708,9.1865,0
Bella stanza Zona 5 / Very nice private room,GRATOSOGLIO - TICINELLO,Private room,1.0,1.0,2,4,40.0,178,10,92.0,45.41495,9.17362,0
Private Stanza M3 Easy transit to Central Stations,ISOLA,Private room,1.0,1.0,2,2,52.0,181,20,99.0,45.49693,9.18565,1
"Independent House in Milan, Crescenzago district",PADOVA,Entire home/apt,1.0,1.0,2,2,32.0,169,26,95.0,45.50455,9.24214,1
❤️Home sweet Home❤️🏠📍Affori centro📍10 min dal centro,AFFORI,Entire home/apt,1.0,1.0,2,2,45.0,364,44,96.0,45.51546,9.176910000000001,1
Un posto a Milano - accommodation South,PORTA ROMANA,Private room,1.0,1.0,4,1,110.0,343,26,94.0,45.45117,9.21137,0
Un posto a Milano - accommodation North,PORTA ROMANA,Private room,1.0,1.0,2,1,80.0,344,41,93.0,45.45117,9.21137,0
Camera matrimoniale all'arco della Pace,SARPI,Private room,1.0,1.0,2,1,50.0,90,16,87.0,45.48281,9.16912,0
Silenziosa Casa di Ringhiera in Zona Porta Venezia,BUENOS AIRES - VENEZIA,Entire home/apt,1.0,1.0,4,1,56.0,1,266,98.0,45.47513,9.21288,1
Milano Design Studio Flat near metro Quiet&Safe,SARPI,Entire home/apt,1.0,1.0,3,4,58.0,336,115,94.0,45.484840000000005,9.16337,0
Double room near San Siro Stadium,BANDE NERE,Private room,1.0,1.0,2,1,36.0,179,14,91.0,45.46413,9.13158,0
VIEWS OF THE MARINA AREA! (015146-CNI-00341),TICINESE,Entire home/apt,2.0,2.0,6,2,90.0,77,55,91.0,45.45313,9.17763,0
Centre-Fiera in 15 min: Piccolo Nido Guest House 3,QT 8,Private room,1.0,1.0,3,1,45.0,178,36,99.0,45.48598,9.14241,1
Suite 8,LODI - CORVETTO,Entire home/apt,2.0,2.0,4,2,100.0,324,104,85.0,45.441959999999995,9.21988,0
New Design Loft for 2 - City Center,GUASTALLA,Entire home/apt,1.0,1.0,2,1,114.0,311,19,96.0,45.45981,9.20005,0
Piazzale Susa Bright Flat with Veranda,CORSICA,Entire home/apt,1.0,1.0,4,2,104.0,0,122,91.0,45.46707,9.22616,0
Charming Double room Sempione Arco della Pace,PAGANO,Private room,1.0,1.0,2,2,62.0,2,39,98.0,45.47592,9.16663,1
CENTRE-FIERA in 15 min: Piccolo Nido Guest House 2,QT 8,Private room,1.0,1.0,2,1,35.0,179,103,98.0,45.48598,9.14241,1
Affascinante stanza a Milano,SELINUNTE,Private room,1.0,1.0,1,1,29.0,325,69,99.0,45.467929999999996,9.13344,0
"Monolocale ""Green Mini Loft"" near Prada Foundation",SCALO ROMANA,Entire home/apt,1.0,1.0,3,2,60.0,49,54,98.0,45.43936,9.20222,0
"""CASA MIA"" cosy & friendly",TIBALDI,Entire home/apt,1.0,1.0,4,2,70.0,179,11,96.0,45.439240000000005,9.18108,0
"MAISON DE CHARME IN MILANO, WI.FI, METRO 200 MT.",LODI - CORVETTO,Entire home/apt,2.0,2.0,4,2,83.0,303,141,95.0,45.43881,9.21612,0
"Monolocale Solari/Tortona, fermata s. Agostino, M2",TORTONA,Entire home/apt,1.0,1.0,2,2,60.0,364,20,96.0,45.45674,9.165239999999999,1
Future Rooms - Fantastic,ISOLA,Private room,1.0,1.0,2,1,39.0,12,170,96.0,45.495709999999995,9.186169999999999,1
Bright single room,BUENOS AIRES - VENEZIA,Private room,1.0,1.0,1,1,31.0,0,28,98.0,45.480270000000004,9.21613,0
Passeggiata a Chinatown = walking in Chinatown,SARPI,Entire home/apt,2.0,1.0,4,1,95.0,20,10,96.0,45.482620000000004,9.17992,0
Marvelous 3bedroom flat in P.ta Venezia 80228 - 09e33cc3,BUENOS AIRES - VENEZIA,Entire home/apt,3.0,2.0,6,1,357.0,261,10,98.0,45.47894,9.21358,0
Grazioso appartamento all'Isola,GARIBALDI REPUBBLICA,Entire home/apt,1.0,1.0,2,1,40.0,145,100,98.0,45.48633,9.18554,1
"""Old Milano Style"" Cosy Apartment - Well Served",SELINUNTE,Entire home/apt,1.0,1.0,2,2,49.0,1,42,97.0,45.46732,9.14339,1
Cosy apartment in the center!,DUOMO,Entire home/apt,1.0,1.0,2,2,129.0,347,59,89.0,45.46222,9.18571,0
Nice small apartament Ripamonti,RIPAMONTI,Entire home/apt,1.0,1.0,4,2,40.0,0,74,94.0,45.4327,9.20154,0
Affascinante appartamento a Milano,LODI - CORVETTO,Entire home/apt,2.0,1.0,6,2,99.0,263,33,94.0,45.44331,9.21888,0
Ma maison: charming and cozy studio apartment,SARPI,Entire home/apt,1.0,1.0,2,1,47.0,124,81,86.0,45.48447,9.16443,0
Bright and White house P.ta Venezia,BUENOS AIRES - VENEZIA,Entire home/apt,1.0,1.0,4,2,80.0,346,90,94.0,45.47596,9.202739999999999,0
ALTIDO Sweet Home: Flat w/Balcony in Shopping District,WASHINGTON,Entire home/apt,2.0,2.0,3,1,70.0,340,15,92.0,45.46536,9.15979,0
Nice Flat in Milan City Center,CENTRALE,Entire home/apt,2.0,1.0,6,2,89.0,180,198,96.0,45.48095,9.20134,1
Central apartment Ticinese,TICINESE,Entire home/apt,2.0,1.0,6,2,125.0,190,25,94.0,45.45557,9.18051,0
♥★ Stylish Apt in Navigli ✿ & Tortona Area ♥★,TICINESE,Entire home/apt,1.0,1.0,2,5,1100.0,168,33,99.0,45.45528,9.17502,1
AMPIO E LUMINOSO APPARTAMENTO IN ZONA TRANQUILLA,LORENTEGGIO,Entire home/apt,2.0,1.0,6,3,80.0,365,10,94.0,45.4492,9.09978,0
Bella Mansarda nel cuore di Milano,DUOMO,Entire home/apt,1.0,1.0,4,1,99.0,355,298,94.0,45.46158,9.18603,0
Charming Manin Suite.,GIARDINI PORTA VENEZIA,Entire home/apt,2.0,1.0,4,1,149.0,17,15,97.0,45.47534,9.20106,1
Elegant apartment in Milan,AFFORI,Entire home/apt,2.0,1.0,5,2,110.0,89,62,98.0,45.52225,9.1726,1
Stylish apartment with terrace in Milan,AFFORI,Entire home/apt,1.0,1.0,4,2,90.0,89,65,99.0,45.52037,9.17314,1
Casa degli Astri - un appartamento sanificato,LORENTEGGIO,Entire home/apt,2.0,1.0,5,1,47.0,0,46,96.0,45.45408,9.12626,0
Cosy apartment near Central Railway Station,BUENOS AIRES - VENEZIA,Entire home/apt,1.0,1.0,2,3,59.0,0,39,97.0,45.484320000000004,9.21039,0
MICO/City Life  Design Apartment,PAGANO,Entire home/apt,1.0,1.0,2,5,78.0,149,37,99.0,45.476620000000004,9.16235,1
Welcoming loft style apartment close to Loreto,LORETO,Entire home/apt,1.0,1.0,4,1,125.0,282,14,86.0,45.48692,9.218689999999999,0
The modern & cozy new shopping Milan area,VILLAPIZZONE,Entire home/apt,1.0,1.0,2,2,52.0,5,19,99.0,45.489979999999996,9.14701,0
Two-room apartment at Navigli,TIBALDI,Entire home/apt,1.0,1.0,4,2,70.0,365,32,98.0,45.44066,9.18075,1
Flatty Apartments - Camillo Vacani,DE ANGELI - MONTE ROSA,Entire home/apt,3.0,1.0,4,2,129.0,254,28,99.0,45.47532,9.143880000000001,1
Strategic apt FieraMilanoCity-MiCo-Centre-SanSiro,DE ANGELI - MONTE ROSA,Entire home/apt,1.0,1.0,3,1,68.0,50,76,99.0,45.47793,9.1487,1
LUXURIOUS 4BDR PENTHOUSE NEAR DUOMO CATHEDRAL,DUOMO,Entire home/apt,4.0,3.0,8,2,421.0,178,68,94.0,45.45701,9.18484,0
"★Charming Nest with Large, Beautiful Terrace★",SARPI,Entire home/apt,1.0,1.0,4,3,93.0,179,13,98.0,45.48555,9.16888,0
Piccolo monolocale a 100 m dalla fermata M1.,BANDE NERE,Entire home/apt,1.0,0.0,3,3,33.0,0,64,98.0,45.46201,9.13749,1
Lussuoso appartamento in stile minimale vicino al Parco Sempione,SARPI,Entire home/apt,4.0,3.0,8,2,509.0,0,28,100.0,45.48341,9.16981,0
Wonderful Central Station Panoramic Penthouse,MACIACHINI - MAGGIOLINA,Entire home/apt,2.0,1.0,4,1,29.0,46,273,95.0,45.49261,9.20226,0
Suite Apartmet 4 Milano Centro,CENTRALE,Entire home/apt,1.0,1.0,4,1,74.0,352,299,87.0,45.48819,9.20535,0
LIBERTY HOUSE MILANO,MAGENTA - S. VITTORE,Entire home/apt,2.0,1.0,4,2,80.0,89,73,95.0,45.469570000000004,9.17073,1
Modern studio in the heart of Milan,TICINESE,Entire home/apt,1.0,1.0,2,29,65.0,88,19,100.0,45.453590000000005,9.17992,0
Stanza + bagno vicino Stazione Centrale,CENTRALE,Private room,1.0,1.0,1,1,25.0,11,113,96.0,45.47857,9.19996,1
"WIFI, Air Conditioning, Stylish. Navigli/Tortona.",TORTONA,Entire home/apt,1.0,1.0,4,3,120.0,242,35,98.0,45.45851,9.16364,1
Beautiful 150m2 Apt in City Center (w/ Balconies),DUOMO,Entire home/apt,3.0,2.0,5,3,140.0,84,48,98.0,45.462070000000004,9.17414,0
Beautiful apartment near central station,GRECO,Private room,1.0,2.0,2,1,46.0,0,259,96.0,45.49859,9.21354,0
Beautiful flat,BRUZZANO,Entire home/apt,1.0,1.5,2,2,48.0,0,187,94.0,45.53112,9.16276,0
Beauty Room in Porta Romana,VIGENTINA,Private room,1.0,2.0,2,1,43.0,0,25,91.0,45.44873,9.195089999999999,0
BRAND NEW LOFT IN NAVIGLI ZONE,TICINESE,Entire home/apt,2.0,2.0,6,1,79.0,165,258,98.0,45.45195,9.18174,1
Light & Modern loft in Milan center,XXII MARZO,Entire home/apt,1.0,1.0,2,2,54.0,126,37,93.0,45.458059999999996,9.20775,0
MOSCOVA - Brera and the Castle,BRERA,Entire home/apt,1.0,1.0,4,1,45.0,71,169,88.0,45.47658,9.18645,0
Brand New Luxury Apartment | Heart of Milan,DUOMO,Entire home/apt,1.0,1.0,2,3,200.0,30,23,100.0,45.459740000000004,9.18395,1
CHIC & CHEAP NEW HOUSE!  easy access to the Centre,GIAMBELLINO,Entire home/apt,1.0,1.0,4,2,45.0,50,164,94.0,45.449009999999994,9.137839999999999,0
Modern apartment with garden in Milan,BANDE NERE,Entire home/apt,1.0,1.0,4,1,160.0,75,12,82.0,45.46293,9.1429,0
An oasis of tranquility in the heart of Milan,TICINESE,Entire home/apt,2.0,2.0,4,2,120.0,202,82,96.0,45.45626,9.175839999999999,0
cozy flat in a quiet zone with a big balcony,RIPAMONTI,Entire home/apt,1.0,1.0,4,1,49.0,0,74,94.0,45.42924,9.20165,0
"""2 minutesRoom"" from the Station!",CENTRALE,Private room,1.0,2.0,2,1,60.0,365,24,89.0,45.49017,9.204930000000001,1
Delizioso appartamento zona gambara,SELINUNTE,Entire home/apt,1.0,1.0,3,2,45.0,71,20,100.0,45.46836,9.138710000000001,0
station central  3rooms free parking,CENTRALE,Entire home/apt,3.0,1.5,11,1,78.0,365,257,89.0,45.48873,9.20535,0
"Warm piace, nice accomodation in a central area",TORTONA,Private room,1.0,1.0,2,1,53.0,260,26,98.0,45.45236,9.16146,0
MAISON DES BOUGIES - CANDLE 'S HOUSE,MECENATE,Private room,1.0,1.0,3,3,50.0,364,70,98.0,45.4427,9.24349,1
Rent single room  -  underground at 100 meters,GALLARATESE,Private room,1.0,1.0,1,3,38.0,76,25,92.0,45.49838,9.10646,0
New & Lovely in Central Milan,SARPI,Entire home/apt,1.0,1.0,2,1,50.0,328,279,93.0,45.47954,9.174760000000001,0
Double-Room Apartment Vicolo Lavandai,NAVIGLI,Entire home/apt,1.0,1.0,5,1,62.0,352,11,95.0,45.45151,9.17401,1
Pretty flat in green residential neighborhood,CITTA' STUDI,Entire home/apt,2.0,1.5,5,1,120.0,0,94,95.0,45.482079999999996,9.23018,0
Garden facing room near Marche M5 metro,MACIACHINI - MAGGIOLINA,Private room,1.0,1.0,2,1,32.0,85,188,97.0,45.49835,9.19698,1
Panfilo Castaldi Cozy flat-link to Malpensa&Linate,BUENOS AIRES - VENEZIA,Entire home/apt,1.0,1.0,4,2,75.0,89,36,84.0,45.47475,9.20652,0
Beloved peculiar and well connected neighborhood!,BAGGIO,Private room,2.0,1.5,2,2,24.0,89,12,100.0,45.46229,9.093580000000001,0
Bright Green room 4min to Metro,MACIACHINI - MAGGIOLINA,Private room,1.0,1.5,2,1,30.0,0,363,94.0,45.490590000000005,9.2014,1
Beautiful Home in Milano,BOVISA,Entire home/apt,1.0,1.0,3,3,60.0,90,12,96.0,45.49825,9.171669999999999,0
LOVELY NEST IN GREAT AREA,CITTA' STUDI,Entire home/apt,1.0,2.0,4,1,104.0,0,115,92.0,45.48234,9.22812,0
Piccolo gioiello in centro,PAGANO,Entire home/apt,1.0,1.0,4,3,91.0,0,88,99.0,45.46712,9.16209,1
MILA SMART LUX MAGENTA,DUOMO,Entire home/apt,1.0,1.0,4,1,94.0,236,22,94.0,45.46562,9.179789999999999,0
Charming Milano Suite -Edera Prima-,BICOCCA,Entire home/apt,1.0,1.0,2,1,31.0,88,44,80.0,45.51377,9.20675,0
Scaldasole - Milan in the Ticinese district - WiFi,TICINESE,Entire home/apt,1.0,1.0,4,2,97.0,329,20,93.0,45.45433,9.17948,0
Modern apartment in Milan,DERGANO,Entire home/apt,1.0,1.0,2,14,20.0,47,27,99.0,45.50457,9.17235,1
PANORAMIC PLAZA APARTMENT - METRO & SHOPPING ST.,BUENOS AIRES - VENEZIA,Entire home/apt,1.0,1.0,2,2,45.0,92,33,100.0,45.48583,9.21654,1
Artsy house with panoramic view,GARIBALDI REPUBBLICA,Private room,1.0,1.0,2,2,38.0,364,30,91.0,45.48435,9.184,0
FIAMMA - 15 minutes to Duomo on foot,XXII MARZO,Entire home/apt,2.0,1.0,5,1,99.0,353,117,84.0,45.46549,9.21269,0
HERMES - 150 meters from the Central Station,CENTRALE,Entire home/apt,2.0,1.0,4,1,85.0,317,283,98.0,45.48534,9.20907,1
Two-rooms apt (6th floor) in the heart of Milan,UMBRIA - MOLISE,Entire home/apt,2.0,1.0,4,1,33.0,87,199,80.0,45.4535,9.21954,0
Amazing loft in Navigli area,TICINESE,Entire home/apt,2.0,2.0,6,1,78.0,77,281,94.0,45.45193,9.18192,1
Moderno zona isola/corso Como,ISOLA,Entire home/apt,1.0,1.0,2,1,120.0,351,128,95.0,45.48619,9.19087,0
Attic with spectacular views of Naviglio,NAVIGLI,Entire home/apt,1.0,1.0,4,2,79.0,178,13,98.0,45.453,9.176039999999999,1
"Coz&Comf 2 room apartment, 3 blocks from CityLife",WASHINGTON,Entire home/apt,1.0,1.0,2,2,40.0,39,18,98.0,45.46685,9.1525,1
Cozy flat in Brera just a step away from the Duomo,BRERA,Entire home/apt,2.0,1.0,4,1,125.0,0,174,99.0,45.468140000000005,9.183869999999999,1
"Mini suite centrale, nuovissima, ogni comfort",CENTRALE,Entire home/apt,1.0,1.0,2,2,39.0,0,13,98.0,45.49151,9.20398,0
"""SUNNY HOUSE"" Apartment in San Siro Area",QUARTO CAGNINO,Entire home/apt,1.0,1.0,2,1,42.0,18,42,96.0,45.47253,9.117980000000001,1
Central and funny apartment with terrace,UMBRIA - MOLISE,Entire home/apt,1.0,1.0,2,2,70.0,0,10,98.0,45.44638,9.21203,0
"★Zen Apartment★ Cheap Relax in Città Studi, Milan",BUENOS AIRES - VENEZIA,Entire home/apt,2.0,1.0,4,2,55.0,255,323,90.0,45.473440000000004,9.22153,0
Loft in zona Tortona dotato di tutti i comfort,TORTONA,Entire home/apt,1.0,1.0,2,2,70.0,364,12,90.0,45.45592,9.16676,0
R 1.Covid free house Max cleaning,CITTA' STUDI,Private room,1.0,1.0,2,1,15.0,157,83,80.0,45.48097,9.22516,0
MIMLNF155 ALTIDO Blooming House,SARPI,Entire home/apt,1.0,1.0,4,1,83.0,263,21,98.0,45.481840000000005,9.169830000000001,0
WINTER LAST MINUTE IN MILAN CITY CENTER,TICINESE,Entire home/apt,1.0,1.0,3,5,40.0,49,12,97.0,45.45755,9.17624,0
single room by Max,BICOCCA,Private room,1.0,1.0,1,1,29.0,0,31,98.0,45.52928,9.215860000000001,0
Nuovissimo e accogliente appartamento a due passi dal Duomo,DUOMO,Entire home/apt,2.0,2.0,6,1,114.0,67,148,95.0,45.46669,9.18062,0
Sempione Park elegant loft- Arco della Pace,SARPI,Entire home/apt,1.0,1.0,4,4,100.0,1,10,100.0,45.476490000000005,9.17198,0
"White Jewel, 2 mins walk from Duomo - all NEW",DUOMO,Entire home/apt,2.0,2.0,6,2,200.0,31,156,98.0,45.46111,9.18498,1
2BDR MI-RHO FAIR 38 MIN BY METRO  SHOPS & SERVICES,LORENTEGGIO,Entire home/apt,2.0,1.0,3,1,53.0,365,12,92.0,45.45565,9.12005,0
GLAMOUR HOUSE - Heart of the city! Parco Sempione,PAGANO,Entire home/apt,1.0,2.0,6,2,69.0,49,173,93.0,45.47545,9.16813,0
Ovolollo's House,PADOVA,Entire home/apt,1.0,1.0,6,1,63.0,0,23,97.0,45.50026,9.223130000000001,0
Loft indipendente - NoLo district - Milano,LORETO,Entire home/apt,2.0,2.0,5,2,120.0,156,83,96.0,45.49126,9.21524,0
Apartment Solferino 37,BRERA,Entire home/apt,1.0,1.0,5,15,53.0,25,12,96.0,45.47967,9.18871,0
114 - Convenience bilocale near subway,PADOVA,Entire home/apt,1.0,1.0,3,1,40.0,0,34,88.0,45.49982,9.220419999999999,0
