name,neighbourhood,room_type,bedrooms,bathrooms,accommodates,minimum_nights,price,availability_365,number_of_reviews,review_score,latitude,longitude,is_superhost
The Studio Milan,TIBALDI,Private room,3.0,3.5,1,4,100.0,358,12,98.0,45.44195,9.17797,0
MPX-Center-EXPO Value/Money,BOVISA,Shared room,1.0,1.0,2,2,24.0,179,55,89.0,45.50465,9.16087,0
""" Characteristic Milanese flat""",NAVIGLI,Entire home/apt,1.0,1.0,4,1,150.0,363,15,93.0,45.449909999999996,9.17597,0
Nico & Cynthia's Easy Yellow Suite,VIALE MONZA,Entire home/apt,1.0,1.0,4,3,75.0,234,15,97.0,45.51988,9.2231,0
Nico&Cinzia's Red Easy Suite!,VIALE MONZA,Entire home/apt,1.0,1.0,4,3,71.0,332,29,96.0,45.519420000000004,9.22615,0
COZY FULLY FURNISHED PRIVATE STUDIO CITY CENTER,BUENOS AIRES - VENEZIA,Private room,1.0,1.0,1,2,55.0,110,34,98.0,45.47018,9.20784,1
Giacinto Cosy & clean flat near MM1,VIALE MONZA,Entire home/apt,2.0,1.0,4,3,75.0,219,37,92.0,45.52111,9.227269999999999,0
"Navigli near down town, linked Expo",TICINESE,Entire home/apt,2.0,1.0,4,2,199.0,362,14,81.0,45.45664,9.17662,0
Nico & Cinzia's Pink Suite!,VIALE MONZA,Entire home/apt,2.0,1.0,5,3,76.0,251,26,90.0,45.52213,9.22693,0
Very Nice Luxury Apt Central Milan,CENTRALE,Entire home/apt,1.0,1.0,2,20,62.0,89,353,85.0,45.48023,9.20181,0
Charming Apt in the heart of Milan,XXII MARZO,Entire home/apt,2.0,2.0,4,2,140.0,80,95,98.0,45.46739,9.20786,1
Chiara & Mesopotamia: Charmy & Lightly home,SARPI,Private room,1.0,1.0,2,1,100.0,364,165,97.0,45.48207,9.17906,1
BRERA LOVELY STUDIO FOR YOU 3,BRERA,Entire home/apt,1.0,1.0,2,2,101.0,356,84,94.0,45.46953,9.192039999999999,0
Brera Open Space Bianco sul Tetto,BRERA,Entire home/apt,1.0,1.0,2,2,150.0,226,174,97.0,45.47251,9.18522,0
Appartamento Design a Sant'Ambrogio,DUOMO,Entire home/apt,1.0,1.0,1,2,70.0,1,269,97.0,45.46102,9.17591,0
BRERA  LOVELY WHITE BOAT STUDIO 2,BRERA,Entire home/apt,1.0,1.0,2,2,70.0,355,70,97.0,45.46978,9.192260000000001,0
Special loft Navigli/Bocconi/Duomo,TICINESE,Entire home/apt,1.0,1.0,3,2,90.0,145,45,97.0,45.448440000000005,9.1822,0
Sunny Apartment Milan,ISOLA,Entire home/apt,1.0,1.0,2,3,79.0,364,10,99.0,45.490190000000005,9.196589999999999,0
PORTA ROMANA SPACIOUS 1BR FLAT - 10 MIN TO DUOMO!,PORTA ROMANA,Entire home/apt,1.0,1.0,4,3,96.0,178,63,97.0,45.4509,9.2117,0
Nice room with private bathroom,LAMBRATE,Private room,1.0,1.0,2,2,23.0,0,462,92.0,45.47057,9.24333,0
Cozy apartment for rent in Milano!!,LAMBRATE,Entire home/apt,1.0,1.0,6,2,45.0,49,37,95.0,45.4708,9.24082,0
The Family Loft|Parking| Istituto dei Tumori,LAMBRATE,Entire home/apt,2.0,2.0,3,1,77.0,14,59,99.0,45.47251,9.24645,1
Beautiful original loft with garden,NAVIGLI,Entire home/apt,2.0,1.0,4,2,150.0,363,12,89.0,45.44678,9.16347,0
Nice quiet room in Navigli district,NAVIGLI,Private room,1.0,1.0,2,2,30.0,1,10,100.0,45.44716,9.17269,0
Elegant Apartment - Milano downtown,GUASTALLA,Entire home/apt,1.0,1.0,3,2,90.0,365,62,97.0,45.47169,9.19748,0
Spacious luminous central flat,XXII MARZO,Private room,1.0,1.0,1,5,55.0,364,10,96.0,45.46635,9.21423,0
44 Suite Harmony Central train Station,CENTRALE,Entire home/apt,1.0,1.0,2,1,70.0,9,444,94.0,45.48336,9.20513,1
Nice Loft close to C.so Como Milan,ISOLA,Entire home/apt,1.0,1.0,4,1,95.0,365,38,99.0,45.487120000000004,9.193,1
Dbl/Trpl Room metro M5 Marche 8' from Central St.,MACIACHINI - MAGGIOLINA,Private room,1.0,1.0,2,1,28.0,75,108,84.0,45.49765,9.19382,0
NiceRoom & SofàBed under the Roof !,ISOLA,Private room,1.0,1.0,2,2,65.0,264,33,96.0,45.4875,9.19183,1
LUXURIOUS bright adjacent Avenida,CITTA' STUDI,Entire home/apt,1.0,1.0,3,1,230.0,365,11,88.0,45.48539,9.22686,0
"S. Siro - Bright, quiet & close to everywhere",S. SIRO,Private room,1.0,1.0,1,90,17.0,365,51,90.0,45.4761,9.12187,0
Magic House in the heart  of town,ISOLA,Entire home/apt,1.0,1.0,2,2,120.0,177,124,97.0,45.48834,9.19086,0
Sunny room: Italian Design taste,CENTRALE,Private room,1.0,1.0,2,1,60.0,365,27,86.0,45.4817,9.20457,0
Cosy room close to Udine metro stop,PARCO LAMBRO - CIMIANO,Private room,1.0,1.0,4,1,26.0,247,70,91.0,45.49103,9.23254,0
Design apartment Wifi Fiera Mico,WASHINGTON,Entire home/apt,1.0,2.0,4,2,79.0,363,146,99.0,45.46378,9.15653,1
Cute Studio to rent in Navigli Area,TICINESE,Entire home/apt,1.0,1.0,1,3,38.0,275,14,86.0,45.44437,9.17628,0
Brand new appartment in Milan,GIAMBELLINO,Entire home/apt,1.0,1.0,3,2,39.0,1,44,96.0,45.44908,9.150889999999999,0
Milan Navigli 1 bedroom flat quaint,NAVIGLI,Entire home/apt,1.0,1.0,4,1,98.0,365,66,86.0,45.4518,9.16995,1
"Nice flat, piano and yoga classes!",XXII MARZO,Private room,1.0,2.0,1,1,49.0,80,247,98.0,45.46784,9.20907,1
Experience a 3 level house in Milan,ISOLA,Private room,1.0,1.0,2,1,49.0,352,123,94.0,45.494659999999996,9.185410000000001,0
Piccolo Attico Duomo // 3-18 months stay contract,DUOMO,Entire home/apt,1.0,1.0,2,15,180.0,48,79,98.0,45.46022,9.182789999999999,0
downtown ONLY for WOMEN  subway wi-fi SINGLE ROOM,PADOVA,Private room,1.0,1.0,1,1,41.0,0,127,97.0,45.503640000000004,9.22199,0
holiday rental apartment milan central,BUENOS AIRES - VENEZIA,Entire home/apt,1.0,1.0,3,3,60.0,301,48,93.0,45.48263,9.21557,0
matrimoni red room on Canals center,NAVIGLI,Private room,1.0,2.5,2,1,40.0,365,135,90.0,45.44657,9.16734,1
Stay at 100m from FieraMilanoCity,DE ANGELI - MONTE ROSA,Entire home/apt,1.0,1.0,5,2,60.0,0,32,99.0,45.48148,9.14697,1
300 yr. old Loft Central Milan,TICINESE,Entire home/apt,1.0,1.0,4,1,75.0,0,344,95.0,45.44928,9.17868,0
Bedroom+bathroom_Milan City Centre,VIGENTINA,Private room,1.0,1.0,1,1,70.0,365,90,95.0,45.45682,9.19396,0
A cozy loft in Milan fully equipped,BOVISASCA,Private room,1.0,1.0,1,2,35.0,180,113,94.0,45.51623,9.156889999999999,0
Bright Openspace in city centre,WASHINGTON,Entire home/apt,1.0,1.0,4,2,145.0,233,35,98.0,45.46267,9.159289999999999,0
Navigli Loft Room with Private Bathroom,TIBALDI,Private room,1.0,1.0,2,7,30.0,0,216,99.0,45.43886,9.18005,1
"Porta Romana, it's so Milan",PORTA ROMANA,Entire home/apt,1.0,1.0,2,2,95.0,294,98,99.0,45.45126,9.20779,0
Comfortable and quiet apartment,BUENOS AIRES - VENEZIA,Entire home/apt,1.0,1.0,2,3,75.0,90,12,92.0,45.47351,9.21983,0
Double bedroom in a 3 level apt,ISOLA,Private room,1.0,1.0,2,1,49.0,182,32,94.0,45.494659999999996,9.18665,0
Big room/bathroom in 70's style,LORENTEGGIO,Private room,1.0,1.5,2,2,60.0,356,113,94.0,45.45564,9.1219,0
pretty apt-navigli-expo,NAVIGLI,Entire home/apt,1.0,1.0,3,30,70.0,364,53,96.0,45.44822,9.159289999999999,0
Cozy & quite apartment in Navigli district Magolfa,NAVIGLI,Entire home/apt,1.0,1.0,4,4,80.0,8,96,94.0,45.4493,9.17522,0
"Really bright flat, downtown Milan",XXII MARZO,Entire home/apt,1.0,1.0,4,2,74.0,170,152,98.0,45.46427,9.2104,1
Extraordinary flat + private garden,CITTA' STUDI,Entire home/apt,2.0,1.0,6,7,250.0,365,10,100.0,45.4834,9.23291,0
central apartment with retro style.,ISOLA,Entire home/apt,1.0,1.0,2,1,99.0,365,48,99.0,45.48983,9.18704,0
Luxury B&B Antica Brera,BRERA,Entire home/apt,2.0,2.0,4,1,270.0,365,68,96.0,45.4724,9.18603,0
Nice double room in Milan Downtown,BUENOS AIRES - VENEZIA,Private room,1.0,1.0,1,2,45.0,2,117,94.0,45.475229999999996,9.206439999999999,1
"Charming Nest, Central, Fiber-Optic",TICINESE,Entire home/apt,3.0,2.0,6,6,277.0,362,139,98.0,45.45734,9.17871,1
MILAN AREA VICTORY ROOM FOR RENT,UMBRIA - MOLISE,Private room,1.0,1.0,2,1,40.0,364,98,93.0,45.4523,9.215110000000001,1
B&B in Comfort Room!,GRATOSOGLIO - TICINELLO,Private room,1.0,2.0,2,28,27.0,142,220,92.0,45.40726,9.17282,0
Charming boutique apartment @ Duomo,DUOMO,Entire home/apt,1.0,1.0,4,1,250.0,365,126,98.0,45.46171,9.18815,0
Stanza Blu in Milan - Navigli Area,TICINESE,Private room,1.0,1.0,3,1,29.0,365,276,89.0,45.44314,9.179910000000001,0
44suite - Joy - central train station,CENTRALE,Entire home/apt,1.0,1.0,3,1,68.0,8,259,95.0,45.48437,9.20399,1
APARTMENT PIAZZA DUOMO MILANO,DUOMO,Entire home/apt,1.0,1.0,6,1,100.0,328,378,94.0,45.46241,9.186639999999999,0
Corso Venezia Senato Quiet penthouse,GUASTALLA,Entire home/apt,1.0,1.0,4,2,79.0,358,77,93.0,45.468720000000005,9.19938,0
Cute attic for romantic people,BUENOS AIRES - VENEZIA,Entire home/apt,1.0,1.0,2,4,59.0,111,173,91.0,45.483470000000004,9.215069999999999,0
AtticCozy-With Rooftop Terrace,BUENOS AIRES - VENEZIA,Entire home/apt,1.0,2.5,4,1,42.0,347,23,96.0,45.480709999999995,9.21308,0
Deliziosa abitazione per soggiorni,BOVISASCA,Private room,1.0,1.0,2,1,45.0,0,29,86.0,45.51462,9.16111,0
Beautiful Very Clean and cozy comfortable bedroom!,GARIBALDI REPUBBLICA,Private room,1.0,1.0,1,1,38.0,294,344,87.0,45.4825,9.183860000000001,0
Vintage House in Milan Downtown with 5 bedrooms,BUENOS AIRES - VENEZIA,Entire home/apt,5.0,3.0,8,2,364.0,157,31,97.0,45.47526,9.20625,1
Your next cozy retreat in Milano!,WASHINGTON,Entire home/apt,1.0,1.0,2,60,70.0,362,12,93.0,45.459759999999996,9.1515,1
Good starting point to discover Mi,XXII MARZO,Private room,1.0,1.0,1,1,39.0,340,207,98.0,45.45879,9.214260000000001,0
Single Sofabed 8' from Central St.,MACIACHINI - MAGGIOLINA,Shared room,1.0,1.0,1,1,20.0,73,60,89.0,45.49758,9.193710000000001,0
"Navigli LOFT, with private garden",TICINESE,Entire home/apt,2.0,2.0,5,2,100.0,363,50,98.0,45.44291,9.17741,0
"70's Design Retro Apartment, Heart of Navigli",TICINESE,Entire home/apt,1.0,1.0,4,6,85.0,0,17,96.0,45.4497,9.17912,0
Stunning flat in classic Milan,SARPI,Entire home/apt,1.0,1.0,2,4,58.0,280,11,95.0,45.48064,9.18215,0
your easychic family in MILANO,BUENOS AIRES - VENEZIA,Private room,1.0,1.0,2,2,63.0,61,42,97.0,45.484609999999996,9.21601,0
Ospedale SACCO - MIND - Fiera Milano Rho,SACCO,Private room,1.0,1.0,2,2,80.0,364,21,98.0,45.51761,9.119660000000001,0
beautiful loft in the trendy area,TICINESE,Entire home/apt,1.0,2.0,2,4,180.0,233,11,100.0,45.45197,9.18093,0
Appartamento di charme in Brera,BRERA,Entire home/apt,2.0,2.0,4,2,171.0,134,95,94.0,45.47793,9.18703,1
room 10 minutes walking from metro,LAMBRATE,Private room,1.0,1.0,3,1,30.0,358,16,94.0,45.48171,9.244069999999999,0
APT 15 min TO CENTER 30 min TO EXPO,PARCO LAMBRO - CIMIANO,Entire home/apt,1.0,1.0,3,3,68.0,365,35,99.0,45.49677,9.23943,0
RedRoom w/balcony 10min by Navigli,S. CRISTOFORO,Private room,1.0,1.0,1,3,27.0,20,65,91.0,45.44,9.15417,0
"Centric studio (Brera). Piano, great view, parking",BRERA,Entire home/apt,1.0,1.5,1,1,59.0,360,54,88.0,45.47462,9.187660000000001,1
Quiet apartment in the docks area,TICINESE,Entire home/apt,1.0,1.0,4,2,93.0,364,43,96.0,45.4547,9.1762,0
Amazing and sunny loft in Navigli.,S. CRISTOFORO,Entire home/apt,1.0,1.0,4,3,220.0,263,10,85.0,45.44355,9.15974,1
Cozy flat in Tortona Quarter,TORTONA,Entire home/apt,1.0,1.0,3,2,80.0,364,46,91.0,45.45407,9.16907,0
Fancy flat between Duomo & Stazione Centrale,BUENOS AIRES - VENEZIA,Entire home/apt,1.0,1.5,2,5,80.0,0,15,93.0,45.477129999999995,9.20352,0
CLAIRE'S HOME- tiny cozy bedroom+ private bathroom,BUENOS AIRES - VENEZIA,Private room,1.0,1.0,2,2,39.0,146,28,99.0,45.471340000000005,9.215819999999999,1
EXPO DOWNTOWN Sempione Castello,SARPI,Entire home/apt,1.0,1.0,2,1,25.0,344,58,91.0,45.47898,9.17429,0
Nice room large terrace central,LORETO,Entire home/apt,1.0,1.0,3,2,70.0,89,11,96.0,45.48854,9.21331,0
CAIROLI TUBE-DUOMO DOWNTOWN-SUPER WIFI-NETFLIX,DUOMO,Entire home/apt,2.0,2.0,4,1,300.0,362,33,95.0,45.468090000000004,9.18266,0
"Accogliente e collegatissimo zona Isola, Milano",ISOLA,Entire home/apt,1.0,1.0,4,2,40.0,1,16,98.0,45.4868,9.19233,0
Milan-Navigli: freshly renewd apt,NAVIGLI,Entire home/apt,1.0,1.0,2,5,130.0,321,11,91.0,45.450540000000004,9.17746,1
villa maraviglia room 1,SARPI,Private room,1.0,1.0,2,2,80.0,365,40,96.0,45.48167,9.17571,0
Apartment in Milan,STADERA,Entire home/apt,1.0,1.0,3,3,35.0,0,26,93.0,45.43695,9.18261,0
Apartment 2 mins from Bocconi Univ,VIGENTINA,Entire home/apt,2.0,1.0,3,30,70.0,355,13,95.0,45.450140000000005,9.19347,0
stanza doppia molto tranquilla,PADOVA,Private room,1.0,0.0,2,1,27.0,365,22,92.0,45.50207,9.23502,0
NICE ATMOSPHER NEAR CENTRAL STATION,CENTRALE,Private room,1.0,1.0,4,1,55.0,364,98,96.0,45.489020000000004,9.204369999999999,1
Ancient house with modern design,UMBRIA - MOLISE,Entire home/apt,3.0,2.0,4,2,100.0,344,47,99.0,45.45117,9.21954,0
"Nice Room Close Stazione Centrale,1 or 2 Guests !!",CENTRALE,Private room,1.0,1.0,2,1,46.0,365,553,96.0,45.490359999999995,9.202810000000001,1
CHARMING ROOM&TERRACE for 1/2LADIES,WASHINGTON,Private room,1.0,1.5,2,1,80.0,364,21,97.0,45.461240000000004,9.16048,1
Chalet in the city,PARCO FORLANINI - ORTICA,Entire home/apt,1.0,1.0,3,2,43.0,234,66,86.0,45.46883,9.24235,0
"Bright ""ParisianStyle"" Studio Apt!",SARPI,Entire home/apt,1.0,1.5,2,3,85.0,364,47,95.0,45.482040000000005,9.16813,1
Navigli's Gardens - Milano,GRATOSOGLIO - TICINELLO,Private room,1.0,1.0,2,2,41.0,365,49,97.0,45.42322,9.17176,0
one bed-room with terrace (Dome),DUOMO,Entire home/apt,1.0,1.0,3,1,125.0,363,21,91.0,45.46076,9.18895,0
"Wonderful Apt for rent, short time!",SARPI,Entire home/apt,1.0,1.0,2,2,60.0,365,17,92.0,45.4829,9.17343,0
Double room with bathroom-Precotto,VIALE MONZA,Private room,1.0,1.5,2,2,40.0,0,16,95.0,45.51204,9.22412,0
Loft in Navigli with round ceiling,S. CRISTOFORO,Entire home/apt,1.0,1.5,4,3,98.0,365,17,93.0,45.445,9.1586,1
Stay in the centre of Milan!!!!!!!!,DUOMO,Private room,1.0,1.0,2,5,60.0,88,33,96.0,45.46136,9.182889999999999,0
Antonia   rent   cozy  apartment,GIAMBELLINO,Private room,1.0,1.0,1,3,27.0,364,15,92.0,45.45163,9.15124,0
Terrace Room with the Roses Silent,CENTRALE,Private room,1.0,1.0,1,1,98.0,365,18,90.0,45.47894,9.20072,0
GLAM CENTRAL PENTHOUSE,ISOLA,Entire home/apt,2.0,1.0,4,1,115.0,288,78,98.0,45.491620000000005,9.18314,1
TOP POSITION  Bed and Breakfast,BUENOS AIRES - VENEZIA,Private room,1.0,2.0,2,2,51.0,217,66,97.0,45.47744,9.2185,1
Elegant and Modern Apartment Next to the Piazza del Duomo,DUOMO,Entire home/apt,2.0,2.0,5,2,210.0,333,169,98.0,45.46243,9.19358,1
Room for rent in downtown area,TICINESE,Private room,1.0,1.0,1,1,35.0,178,13,98.0,45.45657,9.17757,0
room in Milan University District,CITTA' STUDI,Private room,1.0,1.0,1,6,50.0,296,20,94.0,45.48235,9.22761,0
Two-room flat in the City Center,SARPI,Entire home/apt,1.0,1.0,2,7,120.0,358,19,98.0,45.48147,9.176060000000001,0
Klaren's House,SARPI,Private room,1.0,1.0,3,1,41.0,364,106,86.0,45.478,9.17267,0
KLAREN'S HOUSE ARCO DELLA PACE,SARPI,Private room,3.0,2.0,4,2,43.0,90,66,88.0,45.47811,9.17274,0
LOFT Courtyard old Milan near MM 1,LORETO,Entire home/apt,1.0,1.0,5,2,84.0,178,31,95.0,45.491170000000004,9.21955,0
Villa Maraviglia 2° camera,SARPI,Private room,1.0,1.0,2,2,50.0,346,171,91.0,45.48048,9.17785,0
big room in Milano downtown,PARCO LAMBRO - CIMIANO,Private room,1.0,1.0,4,1,54.0,365,16,88.0,45.49142,9.232610000000001,0
"Super central quiet apart. in Milan,  AIR COND!",CENTRALE,Entire home/apt,1.0,1.0,2,1,88.0,202,70,90.0,45.47745,9.19941,0
"Nice Flat, old house style near cc",TIBALDI,Entire home/apt,1.0,1.0,2,365,40.0,293,140,96.0,45.4398,9.17707,0
"MILAN,LARGE CANAL,LOFT/APARTMENT",NAVIGLI,Entire home/apt,2.0,1.0,4,3,80.0,365,175,91.0,45.447720000000004,9.163780000000001,0
it's cute and focal! Nice staying!,TICINESE,Entire home/apt,1.0,1.0,3,1,105.0,363,10,96.0,45.4496,9.18078,0
Bedroom in Milan at 8th floor!,RIPAMONTI,Private room,1.0,2.0,2,1,38.0,89,20,97.0,45.425779999999996,9.20234,0
Perfect flat for Fuorisalone and Salone del mobile,FORZE ARMATE,Entire home/apt,1.0,1.0,4,3,120.0,171,11,98.0,45.46144,9.12824,0
Stanza singola in Chinatown,SARPI,Private room,1.0,0.0,1,1,65.0,365,72,96.0,45.47963,9.17746,1
Charming apartment in Milan,S. CRISTOFORO,Entire home/apt,1.0,1.0,2,2,65.0,342,20,94.0,45.44383,9.15278,0
Very nice apartment,BUENOS AIRES - VENEZIA,Entire home/apt,1.0,1.0,2,2,45.0,294,22,91.0,45.47603,9.22252,0
Room in the heart of Navigli area,NAVIGLI,Private room,1.0,1.0,2,1,55.0,364,113,97.0,45.45219,9.17578,1
Room with private kitchen and bathroom.,DE ANGELI - MONTE ROSA,Private room,1.0,1.0,2,2,35.0,87,73,89.0,45.47285,9.14546,0
ROOFTOP APARTMENT-DUOMO - Disinfection protocols,DUOMO,Entire home/apt,1.0,1.0,2,7,100.0,25,400,99.0,45.45942,9.18465,1
Cool apartment in the city center,MAGENTA - S. VITTORE,Entire home/apt,1.0,1.0,2,7,74.0,178,10,98.0,45.46006,9.16954,0
"Lovely room with A/C,15' from Duomo",STADERA,Private room,1.0,1.0,3,1,23.0,365,87,93.0,45.433370000000004,9.18323,0
SpecialOffer for students in Milano,ISOLA,Private room,1.0,1.0,1,5,39.0,263,38,100.0,45.4863,9.19315,1
Moscova next to Parco Sempione studio,SARPI,Entire home/apt,1.0,1.0,2,2,95.0,365,48,90.0,45.47769,9.179839999999999,0
Old Milan close to Duomo and Centre,DUOMO,Entire home/apt,1.0,1.0,4,5,74.0,319,149,96.0,45.45984,9.18034,1
"DUOMO 5 stops subway, ALL INCLUSIVE",PADOVA,Entire home/apt,1.0,1.0,4,1,45.0,354,34,93.0,45.49609,9.22822,0
Room in a Yellow Design Flat,ISOLA,Private room,1.0,1.0,1,4,38.0,0,71,99.0,45.493809999999996,9.189910000000001,0
Nice studio in Porta Venezia area,BUENOS AIRES - VENEZIA,Entire home/apt,1.0,1.0,2,1,61.0,364,30,84.0,45.473929999999996,9.21167,0
"Central charming cozy, fully equipped.",BUENOS AIRES - VENEZIA,Entire home/apt,1.0,1.0,4,2,70.0,0,63,98.0,45.46925,9.20795,1
Quiet island in the heart of Milano,DUOMO,Entire home/apt,1.0,1.0,4,2,120.0,90,49,92.0,45.45967,9.182030000000001,0
Private room&private bathroom-WIFI,VIALE MONZA,Private room,1.0,1.0,2,2,46.0,365,11,96.0,45.51911,9.23018,0
"EXPO - Nice loft in Milan ""Navigli""",S. CRISTOFORO,Entire home/apt,2.0,2.0,3,2,120.0,364,16,97.0,45.44713,9.15588,0
Duomo Loft,DUOMO,Entire home/apt,1.0,1.0,4,1,70.0,171,446,94.0,45.461690000000004,9.18913,0
Ultra Center Milan Lima / Corso Buenos Aires,BUENOS AIRES - VENEZIA,Entire home/apt,2.0,1.0,5,2,81.0,356,52,97.0,45.478609999999996,9.21382,0
orange room matrimonial navigli,NAVIGLI,Private room,1.0,1.0,2,1,50.0,365,92,80.0,45.446329999999996,9.16522,1
single room on navigli canals cente,NAVIGLI,Private room,1.0,1.0,1,1,33.0,365,13,88.0,45.4473,9.16715,1
white doublebed on navigli center,NAVIGLI,Private room,1.0,1.0,2,1,52.0,365,195,85.0,45.445890000000006,9.16672,1
il focolare domestico,BANDE NERE,Private room,1.0,1.0,2,1,40.0,180,20,96.0,45.45581,9.14362,0
Apartment located in Porta Venezia,BUENOS AIRES - VENEZIA,Entire home/apt,1.0,1.0,4,4,116.0,0,10,94.0,45.471270000000004,9.21068,0
Cozy flat in Central Milan,VIGENTINA,Entire home/apt,1.0,1.0,2,3,80.0,0,13,90.0,45.44956,9.194339999999999,0
large studio milano - navigli,NAVIGLI,Entire home/apt,1.0,1.0,2,30,30.0,344,111,98.0,45.45106,9.173860000000001,1
FINE STRATEGIC LOFT IN MILAN 15 MIN TO DUOMO,FARINI,Entire home/apt,1.0,1.0,2,2,36.0,203,19,97.0,45.49648,9.1686,1
GORGEOUS 6PEOPLE 10 mins Duomo wif,PORTA ROMANA,Entire home/apt,1.0,1.0,4,3,66.0,334,105,86.0,45.44905,9.19988,0
Beautiful and Cosy Flat in Loreto,CITTA' STUDI,Entire home/apt,1.0,1.0,2,3,53.0,72,75,98.0,45.48543,9.22387,1
DISCIPLINI - Luxury apt at Duomo,DUOMO,Entire home/apt,1.0,1.0,2,1,30.0,348,379,84.0,45.45762,9.18628,0
Milano centro bilocale vicino Duomo,XXII MARZO,Entire home/apt,1.0,1.0,2,3,82.0,362,54,90.0,45.46042,9.20915,0
Charming conveniently located loft,MAGENTA - S. VITTORE,Entire home/apt,1.0,1.0,4,1,88.0,270,138,90.0,45.457240000000006,9.1715,0
Cozy Room | Navigli area SouthMilan,TIBALDI,Private room,1.0,1.0,2,3,38.0,365,21,97.0,45.437979999999996,9.179210000000001,0
"Comfy and quiet, great location",CENTRALE,Entire home/apt,1.0,1.0,4,2,80.0,338,13,100.0,45.48816,9.208689999999999,0
Delicious apt in the Ticinese,TICINESE,Entire home/apt,1.0,1.0,4,3,75.0,178,19,93.0,45.45555,9.179730000000001,0
Double room Navigli/Duomo/Bocconi,TICINESE,Private room,1.0,1.0,2,2,50.0,179,141,95.0,45.44982,9.1804,0
Viafarini in residence | Orange,ISOLA,Entire home/apt,1.0,1.0,3,1,70.0,171,50,82.0,45.49031,9.183710000000001,0
Camera matrimoniale in Città Studi,CORSICA,Private room,1.0,2.0,2,1,40.0,360,131,92.0,45.4674,9.2317,1
CENTRAL CHARMING TERRACE DUOMO VIEW,GUASTALLA,Entire home/apt,2.0,1.0,5,2,84.0,355,154,94.0,45.455009999999994,9.20145,0
2 km DUOMO wifi aircon PortaRomana,PORTA ROMANA,Entire home/apt,1.0,1.0,2,1,51.0,359,37,83.0,45.44977,9.202869999999999,0
Garden Loft + parking,MACIACHINI - MAGGIOLINA,Entire home/apt,2.0,2.0,5,4,120.0,203,30,98.0,45.50289,9.20187,0
MILANO CENTRAL LUXURY - 3 BDR - 7 Guests,CENTRALE,Entire home/apt,3.0,2.0,7,2,284.0,288,88,96.0,45.483090000000004,9.20435,1
DREAM GARDEN CITY CENTER ON SUBWAY!,BUENOS AIRES - VENEZIA,Entire home/apt,3.0,2.0,10,1,189.0,188,363,95.0,45.48048,9.21135,0
Fantastic Apartment in the City Centre,VIGENTINA,Entire home/apt,1.0,1.0,2,1,58.0,1,317,97.0,45.45532,9.18795,1
44suite - silence - central station milan,CENTRALE,Entire home/apt,1.0,1.0,2,1,70.0,8,231,95.0,45.483270000000005,9.205039999999999,1
Elegant Loft Conversion Ex Marble Workshop,S. CRISTOFORO,Entire home/apt,1.0,1.0,4,3,70.0,364,65,97.0,45.447070000000004,9.15405,0
La Cascina,S. CRISTOFORO,Entire home/apt,2.0,2.0,6,2,190.0,336,25,94.0,45.44429,9.16065,1
Bright Apartment in Area Isola,ISOLA,Entire home/apt,2.0,2.0,5,2,110.0,365,45,81.0,45.485,9.189630000000001,0
2 B&B in Milan with trees & metro,GALLARATESE,Private room,1.0,2.0,2,1,69.0,364,57,93.0,45.49677,9.12337,0
Typical Old Milano house style Navigli Darsena,TICINESE,Entire home/apt,1.0,1.0,4,4,25.0,0,86,97.0,45.45032,9.17785,0
"Sempione Park.Cadorna, Castello - Free Fiber WIFI",PAGANO,Entire home/apt,1.0,1.0,3,3,95.0,327,60,97.0,45.47585,9.16835,1
"Bright center MI subway lines1,2 &3",BUENOS AIRES - VENEZIA,Entire home/apt,1.0,1.0,5,1,60.0,0,195,95.0,45.48226,9.21273,0
SETTALA - Art Déco- 5 pax,BUENOS AIRES - VENEZIA,Entire home/apt,1.0,1.0,5,1,30.0,345,559,85.0,45.48219,9.2089,0
TICINESE monastery close  DUOMO,TICINESE,Entire home/apt,2.0,2.0,5,6,220.0,49,57,94.0,45.45584,9.17912,0
Spacious open space near the Navigl,TICINESE,Entire home/apt,1.0,1.0,4,2,100.0,263,58,92.0,45.45114,9.182789999999999,0
Lux/Late availability@GaribaldiMM2,SARPI,Entire home/apt,1.0,1.0,4,2,90.0,0,24,96.0,45.48316,9.18084,0
"central, charming & very italian",XXII MARZO,Private room,1.0,1.0,2,2,50.0,0,90,93.0,45.46152,9.214139999999999,0
Comfortable Single Room city center,XXII MARZO,Private room,1.0,1.0,2,1,79.0,365,10,92.0,45.45961,9.21212,0
Artist's Apartment in Milano Brera,BRERA,Entire home/apt,1.0,1.0,4,2,100.0,110,93,96.0,45.47547,9.183869999999999,0
"Apartment in Porta Romana, a true Milan experience",PORTA ROMANA,Entire home/apt,1.0,1.0,4,2,90.0,297,60,97.0,45.450140000000005,9.20982,1
Colourful apartment in the court,LORETO,Entire home/apt,1.0,1.0,4,2,80.0,0,27,94.0,45.4892,9.21143,0
"Elegant, quiet and luminous flat",SARPI,Entire home/apt,1.0,2.0,2,3,80.0,364,27,96.0,45.48692,9.159510000000001,0
Bright flat + balcony Isola (Garibaldi metro),ISOLA,Entire home/apt,1.0,1.0,3,3,90.0,84,14,89.0,45.489129999999996,9.1825,0
Stunning penthouse in Brera's heart,BRERA,Private room,1.0,1.0,2,2,85.0,364,13,100.0,45.474790000000006,9.18789,0
Blue room in the trees,FORZE ARMATE,Private room,1.0,1.0,2,7,50.0,0,17,95.0,45.460770000000004,9.10464,0
confort. bed room(curtain divided),PADOVA,Private room,1.0,0.0,1,1,20.0,364,34,88.0,45.50209,9.235510000000001,0
apartment in martesana garden,PADOVA,Entire home/apt,2.0,1.0,6,6,191.0,362,18,83.0,45.50164,9.23385,0
Lovely architect apartment for rent,ISOLA,Entire home/apt,1.0,1.0,3,4,264.0,172,17,91.0,45.4911,9.19022,0
Cozy Apartment In Isola Distr,ISOLA,Entire home/apt,1.0,1.0,2,3,68.0,362,43,99.0,45.49143,9.19002,0
Little cosy room in center of Milan,SARPI,Private room,1.0,1.0,2,3,56.0,358,17,91.0,45.482240000000004,9.1679,0
confortable bed place!,PADOVA,Shared room,1.0,0.0,1,1,18.0,365,34,94.0,45.50178,9.23548,0
Villa with garden near to Rho Fiera,VILLAPIZZONE,Private room,2.0,2.0,3,2,80.0,365,18,87.0,45.49454,9.155669999999999,0
MILAN ROMANTIC-DUOMO-EXPO,GHISOLFA,Entire home/apt,2.0,1.0,4,2,87.0,286,163,97.0,45.49087,9.16547,1
Cosy Place Tortona- Mudec Museum- Darsena,TORTONA,Entire home/apt,1.0,1.0,4,2,48.0,19,108,88.0,45.45175,9.15885,0
Town centre - metrò Porta Romana,GUASTALLA,Entire home/apt,1.0,1.0,2,31,68.0,171,34,93.0,45.45472,9.20342,0
Appartamento zona  Naviglio con Garden privato,NAVIGLI,Entire home/apt,1.0,1.0,3,2,65.0,328,294,94.0,45.44852,9.17662,1
Sunny Design Loft in Milan,GIAMBELLINO,Entire home/apt,1.0,1.0,4,1,100.0,178,157,97.0,45.44989,9.14857,1
Green Apartment  in Milan,QT 8,Entire home/apt,2.0,2.0,7,30,50.0,0,86,97.0,45.486670000000004,9.13932,1
Glamour next to Leonardo's Cenacolo,MAGENTA - S. VITTORE,Entire home/apt,1.0,1.5,2,6,70.0,348,96,98.0,45.46848,9.172080000000001,0
A small cosy flat downtown Milan!,XXII MARZO,Entire home/apt,1.0,1.0,2,28,80.0,246,15,87.0,45.46577,9.208839999999999,0
My littlehome in the heart of Milan,SARPI,Entire home/apt,1.0,1.0,3,2,58.0,365,22,92.0,45.48336,9.1665,1
NouvelleVague room w/balcony- 10 min by Navigli,S. CRISTOFORO,Private room,1.0,1.0,1,3,27.0,147,65,86.0,45.43918,9.15267,0
Double Room - Milan Central Station,CENTRALE,Private room,1.0,1.5,2,1,61.0,245,28,86.0,45.48323,9.20299,0
Flat in Naviglio Grande with WIFI,NAVIGLI,Entire home/apt,1.0,1.0,2,2,66.0,362,25,93.0,45.45146,9.16957,0
Fantastic Loft on the Navigli!,S. CRISTOFORO,Entire home/apt,2.0,2.5,4,28,126.0,252,20,88.0,45.44579,9.15054,0
strawberry house,LORETO,Entire home/apt,1.0,1.0,2,3,40.0,360,121,92.0,45.49235,9.22551,0
L.A.G.M. - Loft Art Garden Milan,MACIACHINI - MAGGIOLINA,Entire home/apt,1.0,1.0,4,1,75.0,324,29,96.0,45.502359999999996,9.19566,0
Bella ed spaziosa  camera condivisa,BOVISA,Shared room,1.0,1.0,2,7,22.0,0,28,99.0,45.50111,9.17036,1
rent my apartment for short periods,MAGENTA - S. VITTORE,Entire home/apt,1.0,1.0,2,2,80.0,364,38,97.0,45.47025,9.16827,0
Apartments near the New Milan Fairs,VILLAPIZZONE,Private room,1.0,1.0,2,2,53.0,364,12,91.0,45.49643,9.1472,0
